{"$schema":"https://json-schema.org/draft/2020-12/schema","$id":"https://salus.example/schemas/uc2/relationship.schema.json","type":"object","additionalProperties":false,"required":["relationship_id","source_id","relationship_type","target_id","record_status","source_reference","assumption_id","notes"],"properties":{"relationship_id":{"type":"string","pattern":"^UC2-R[0-9]{3}$"},"source_id":{"type":"string","pattern":"^UC2-"},"relationship_type":{"enum":["contains","deployed_in","connected_to","communicates_with","senses","controls","actuates","feeds","stores","observes","monitored_by","protected_by","governed_by","operated_by","owned_by","mirrored_by","depends_on","targets","triggers","mitigated_by","generates","derived_from","supports_claim","transfers_custody_to"]},"target_id":{"type":"string","pattern":"^UC2-"},"record_status":{"enum":["proposal","engineering_decision","synthetic_default","assumed","TBD","partner_confirmed"]},"source_reference":{"type":"string","minLength":1},"assumption_id":{"type":"string"},"notes":{"type":"string"}}}

