[
  {
    "assumption_id": "",
    "notes": "Passive only",
    "record_status": "proposal",
    "relationship_id": "UC2-R001",
    "relationship_type": "observes",
    "source_id": "UC2-D01",
    "source_reference": "PROPOSAL-UC2-PP15-16",
    "target_id": "UC2-D04"
  },
  {
    "assumption_id": "",
    "notes": "Passive only",
    "record_status": "proposal",
    "relationship_id": "UC2-R002",
    "relationship_type": "observes",
    "source_id": "UC2-D02",
    "source_reference": "PROPOSAL-UC2-PP15-16",
    "target_id": "UC2-D04"
  },
  {
    "assumption_id": "",
    "notes": "Passive only",
    "record_status": "proposal",
    "relationship_id": "UC2-R003",
    "relationship_type": "observes",
    "source_id": "UC2-D03",
    "source_reference": "PROPOSAL-UC2-PP15-16",
    "target_id": "UC2-D04"
  },
  {
    "assumption_id": "",
    "notes": "Passive only",
    "record_status": "proposal",
    "relationship_id": "UC2-R004",
    "relationship_type": "observes",
    "source_id": "UC2-D01",
    "source_reference": "PROPOSAL-UC2-PP15-16",
    "target_id": "UC2-D05"
  },
  {
    "assumption_id": "",
    "notes": "Passive only",
    "record_status": "proposal",
    "relationship_id": "UC2-R005",
    "relationship_type": "observes",
    "source_id": "UC2-D02",
    "source_reference": "PROPOSAL-UC2-PP15-16",
    "target_id": "UC2-D05"
  },
  {
    "assumption_id": "",
    "notes": "Passive only",
    "record_status": "proposal",
    "relationship_id": "UC2-R006",
    "relationship_type": "observes",
    "source_id": "UC2-D03",
    "source_reference": "PROPOSAL-UC2-PP15-16",
    "target_id": "UC2-D05"
  },
  {
    "assumption_id": "",
    "notes": "Pseudonymous metadata",
    "record_status": "engineering_decision",
    "relationship_id": "UC2-R007",
    "relationship_type": "feeds",
    "source_id": "UC2-D01",
    "source_reference": "PROPOSAL-UC2-PP15-16",
    "target_id": "UC2-S01"
  },
  {
    "assumption_id": "",
    "notes": "Pseudonymous metadata",
    "record_status": "engineering_decision",
    "relationship_id": "UC2-R008",
    "relationship_type": "feeds",
    "source_id": "UC2-D02",
    "source_reference": "PROPOSAL-UC2-PP15-16",
    "target_id": "UC2-S01"
  },
  {
    "assumption_id": "",
    "notes": "Pseudonymous metadata",
    "record_status": "engineering_decision",
    "relationship_id": "UC2-R009",
    "relationship_type": "feeds",
    "source_id": "UC2-D03",
    "source_reference": "PROPOSAL-UC2-PP15-16",
    "target_id": "UC2-S01"
  },
  {
    "assumption_id": "",
    "notes": "Hypothesis lookup",
    "record_status": "engineering_decision",
    "relationship_id": "UC2-R010",
    "relationship_type": "feeds",
    "source_id": "UC2-S01",
    "source_reference": "PROPOSAL-UC2-PP15-16",
    "target_id": "UC2-S02"
  },
  {
    "assumption_id": "",
    "notes": "Approval decision",
    "record_status": "engineering_decision",
    "relationship_id": "UC2-R011",
    "relationship_type": "triggers",
    "source_id": "UC2-S02",
    "source_reference": "PROPOSAL-UC2-PP15-16",
    "target_id": "UC2-S03"
  },
  {
    "assumption_id": "",
    "notes": "Alert",
    "record_status": "engineering_decision",
    "relationship_id": "UC2-R012",
    "relationship_type": "triggers",
    "source_id": "UC2-S03",
    "source_reference": "PROPOSAL-T41-T45",
    "target_id": "UC2-S04"
  },
  {
    "assumption_id": "",
    "notes": "Human review",
    "record_status": "proposal",
    "relationship_id": "UC2-R013",
    "relationship_type": "operated_by",
    "source_id": "UC2-S04",
    "source_reference": "PROPOSAL-UC2-PP15-16",
    "target_id": "UC2-A01"
  },
  {
    "assumption_id": "",
    "notes": "Evidence",
    "record_status": "proposal",
    "relationship_id": "UC2-R014",
    "relationship_type": "generates",
    "source_id": "UC2-S03",
    "source_reference": "PROPOSAL-T33-T36",
    "target_id": "UC2-S05"
  },
  {
    "assumption_id": "",
    "notes": "Consultation",
    "record_status": "proposal",
    "relationship_id": "UC2-R015",
    "relationship_type": "feeds",
    "source_id": "UC2-S05",
    "source_reference": "PROPOSAL-UC2-PP15-16",
    "target_id": "UC2-S06"
  },
  {
    "assumption_id": "",
    "notes": "Investigation",
    "record_status": "proposal",
    "relationship_id": "UC2-R016",
    "relationship_type": "operated_by",
    "source_id": "UC2-S06",
    "source_reference": "PROPOSAL-UC2-PP15-16",
    "target_id": "UC2-A02"
  },
  {
    "assumption_id": "",
    "notes": "Twin",
    "record_status": "engineering_decision",
    "relationship_id": "UC2-R017",
    "relationship_type": "mirrored_by",
    "source_id": "UC2-D01",
    "source_reference": "PROPOSAL-T41-T45",
    "target_id": "UC2-DT01"
  },
  {
    "assumption_id": "",
    "notes": "Twin",
    "record_status": "engineering_decision",
    "relationship_id": "UC2-R018",
    "relationship_type": "mirrored_by",
    "source_id": "UC2-D02",
    "source_reference": "PROPOSAL-T41-T45",
    "target_id": "UC2-DT02"
  },
  {
    "assumption_id": "",
    "notes": "Twin",
    "record_status": "engineering_decision",
    "relationship_id": "UC2-R019",
    "relationship_type": "mirrored_by",
    "source_id": "UC2-D03",
    "source_reference": "PROPOSAL-T41-T45",
    "target_id": "UC2-DT03"
  },
  {
    "assumption_id": "",
    "notes": "Twin",
    "record_status": "engineering_decision",
    "relationship_id": "UC2-R020",
    "relationship_type": "mirrored_by",
    "source_id": "UC2-D04",
    "source_reference": "PROPOSAL-T41-T45",
    "target_id": "UC2-DT04"
  },
  {
    "assumption_id": "",
    "notes": "Twin",
    "record_status": "engineering_decision",
    "relationship_id": "UC2-R021",
    "relationship_type": "mirrored_by",
    "source_id": "UC2-D05",
    "source_reference": "PROPOSAL-T41-T45",
    "target_id": "UC2-DT05"
  },
  {
    "assumption_id": "",
    "notes": "Synthetic scene",
    "record_status": "engineering_decision",
    "relationship_id": "UC2-R022",
    "relationship_type": "deployed_in",
    "source_id": "UC2-D01",
    "source_reference": "ROADMAP-T43",
    "target_id": "UC2-NZ01"
  },
  {
    "assumption_id": "",
    "notes": "Logical",
    "record_status": "engineering_decision",
    "relationship_id": "UC2-R023",
    "relationship_type": "deployed_in",
    "source_id": "UC2-S01",
    "source_reference": "ROADMAP-T43",
    "target_id": "UC2-NZ02"
  },
  {
    "assumption_id": "",
    "notes": "Restricted",
    "record_status": "engineering_decision",
    "relationship_id": "UC2-R024",
    "relationship_type": "deployed_in",
    "source_id": "UC2-S05",
    "source_reference": "ROADMAP-T43",
    "target_id": "UC2-NZ03"
  },
  {
    "assumption_id": "",
    "notes": "Synthetic",
    "record_status": "synthetic_default",
    "relationship_id": "UC2-R025",
    "relationship_type": "stores",
    "source_id": "UC2-S01",
    "source_reference": "PROPOSAL-DS2-DS3-P19",
    "target_id": "UC2-DS01"
  },
  {
    "assumption_id": "",
    "notes": "Future mapping",
    "record_status": "proposal",
    "relationship_id": "UC2-R026",
    "relationship_type": "derived_from",
    "source_id": "UC2-DS02",
    "source_reference": "PROPOSAL-DS2-DS3-P19",
    "target_id": "UC2-DS01"
  }
]
